input_data,predict,answer
G P G S I P D Y Q E Q D I F L W R K E T G F G F R I L G G N E P G E P I Y I G H I V P L G A A D T D G R L R S G D E L I C V D G T P V I G K S H Q L V V Q L M Q Q A A K Q G H V N L T V R R K V V, # # # # # # # # # # # # # # # # # # # # # # # # # # # # # # # # # # # # # # # # # # # # # # # # # # # # # # # # # # # # # # # # # # # # # # # # # # # # # # # # # # # # # # # # # # ,# # # # # # # S S S S S S S S S # # # # # # # S S S S S # # # # # # # S S S S S S # # # H H H H H H H # # # # # # S S S S S # # S S # # # # H H H H H H H H H H H H H H H H S S S S S S S S S # #
M K K A N E A L T R N R E L T T V L V K N L P K S Y N Q N K V Y K Y F K H C G P I I H V D V A D S L K K N F R F A R I E F A R Y D G A L A A I T K T H K V V G Q N E I I V S H L T E C T L W M T N F P P S Y T Q R N I R D L L Q D I N V V A L S I R L P S L R F N T S R R F A Y I D V T S K E D A R Y C V E K L N G L K I E G Y T L V T K V S N P L E K S K R T D S A T L E G R E I M I R N L S T E L L D E N L L R E S F E G F G S I E K I N I P A G Q K E H S F N N C C A F M V F E N K D S A E R A L Q M N R S L L G N R E I S V S L A D K K P F L E R N E V K R L L A S R N S K E L E T L I C L F P L S D K V S P S L I C Q F L Q E E I H I N E K D I R K I L L V S D F N G A I I I F R D S K F A A K M L M I L N G S Q F Q G K V I R S G T I N D M K R Y Y N N Q Q N H S M K H V K P S C I N M M E K G P N L Q V K K K I P D K Q E Q M S N D D F R K M F L G E H H H H H H, # # # # # # # # # # # # # # # # # # # # # # # # # # # # # # # # # # # # # # # # # # # # # # # # # # # # # # # # # # # # # # # # # # # # # # # # # # # # # # # # # # # # # # # # # # # # # # # # # # # # # # # # # # # # # # # # # # # # # # # # # # # # # # # # # # # # # # # # # # # # # # # # # # # # # # # # # # # # # # # # # # # # # # # # # # # # # # # # # # # # # # # # # # # # # # # # # # # # # # # # # # # # # # # # # # # # # # # # # # # # # # # # # # # # # # # # # # # # # # # # # # # # # # # # # # # # # # # # # # # # # # # # # # # # # # # # # # # # # # # # # # # # # # # # # # # # # # # # # # # # # # # # # # # # # # # # # # # # # # # # # # # # # # # # # # # # # # # # # # # # # # # # # # # # # # # # # # # # # # # # # # # # # # # # # # # # # # # # # # # # # # # # # # # # # # # # # # # # # # # # # # # # # # # # # # # # # # # # # # # # # # # # # # # # # #,# # # # # H H H H H H H H H H S S S S S S S # # # # H H H H H H H H H H H H H # S S S S S S S S # # # # # # S S S S S S S # H H H H H H H H H H # # # # S S # # S S # S S S S # # # # S S S S S # # # # # # H H H H H H H H H H H H # # # S S S S S # # # # # # # # # # # S S S S S S # H H H H H H H H H H H H H # # S S # # S S # S S S S # H H H H H # # # # H H H H H H # # S S S S S S S H H H H H H H H H H H H H H H H H H # S S S S S # # # # # # # # # # # # S S S S S S S # H H H H H H H H H H H H # # S S # # S S # S S S S # # H H H H H H H H H H H H H H H H # # # # H H H # S S S S S # # # # # # H H H H H H H H H H H H # # # H H H # S S S S S S S H H H H S S S S S S # H H H H H H H H H H H H H # # S S # # S S # S S S H H H H H H H H H H H H H # # # # # # # # # # # # # # # # # # # # # # # # # # # # # # # # # # # # # # # # # # # # # # # # # # # #
M L E K K R V S F R P M N E D D L V L M L K W L T D D R V L E F Y D G R D K K H T Q K T I R E H Y T E Q W A D E I Y R V I I E Y D T I P I G Y A Q I Y R I Q G E L F D E Y N Y H E T E E K I Y A M D Q F I G E P E Y W N M G I G A E Y C R V V C Q Y L R T E M D A D A V I L D P R K N N L R A V R A Y Q K A G F K I I K E L P E H E L H E G K K E D C V L M E W R V, # # # # # # # # # # # # # # # # # # # # # # # # # # # # # # # # # # # # # # # # # # # # # # # # # # # # # # # # # # # # # # # # # # # # # # # # # # # # # # # # # # # # # # # # # # # # # # # # # # # # # # # # # # # # # # # # # # # # # # # # # # # # # # # # # # # # # # # # # # # # # # # # H H H H H H H H H H H H H H H H H H H H H H H H H H H H H H H H H H H H H H H H,# # # # # # S S S S S # H H H H H H H H H H H H # H H H H H H # # # # # # # # # H H H H H H H H H H # # # # # # S S S S S S S S # # S S S S S S S S S S # H H H H H H H H H # # # # # # # S S S S S S S S # H H H H H # # H H H H H H H H H H H H H H H H H H H # # S S S S # # # # # H H H H H H H H H H H # # S S S S S S S S S S S S # # S S S S S S S S S S # #
G P M T L P K M E P S S H A P T E P D I Q K D K D D S I I R E N E N I P A P L G T V V Q L L F G S N T E Y M Q K V I T R D K N N V N V E T I P K F T P S L V E G G S R H Y E Y T K K L N N S I G P K Q T K C L L T E S I E H M D I N N Y V L V T Q T T K T P D V P S G S N F A V E S K I F L F W G Q H D T T N M T V I T K I N W T S K S F L K G A I E K G S V E G Q K V S V D Y M L S E L R D I I S R A K S K K P V K, # # # # # # # # # # # # # # # # # # # # # # # # # # # # # # # # # # # # # # # # # # # # # # # # # # # # # # # # # # # # # # # # # # # # # # # # # # # # # # # # # # # # # # # # # # # # # # # # # # # # # # # # # # # # # # # # # # # # # # # # # # # # # # # # # # # # # # # # # # # # # # # # # # # # # # # # # # # # # # # # # # # # # # # # # # # # # # # # # # # # # # # # # # # # # # # # # # # # # # # # # # # # # # # # #,# # # # # # # # # # # # # # # # # # # # # # # # # # S S S S S S S S S # # H H H H H H H H H H H # # H H H H H H H H H H H # # S S # # # # # # # # # # # # # # # # S S S S S S S S S # # # # # # # # S S S S S S S S S S S S S # # # # S S S S S S S S S # # # # # H H H # S S S S S S S S S S S # H H H # S S S S S S S S S S S # # # # # H H H H H H H H H H H H H H H H H H H H H H H H H H H H H H H H H # # # # #
S M A Q D K R S G F L T L G Y R G S Y T T V R D N Q A D A K F R R V A R I M V C G R I A L A K E V F G D T L N E S R D P D R Q P E K Y T S R F Y L K F T Y L E Q A F D R L S E A G F H M V A C N S S G T A A F V N Q Y R D D K I W S S Y T E Y I F F R P, # # # # # # # # # # # # # # # # # # # # # # # # # # # # # # # # # # # # # # # # # # # # # # # # # # # # # # # # # # # # # # # # # # # # # # # # # # # # # # # # # # # # # # # # # # # # # # # # # # # # H H H H H H H H H H H H H H H H H H H H H H H H H H H H H H,# # # # # # # # S S S S S S S S S S # # # # # # # # # # # # # # # # # S S S S S S S H H H H H H H H H H H H # # # # # # # # # # # # # S S S S S # # # # H H H H H H H H H H H H # # S S S S S S S S S S S S # # # # # # # # # S S S S S S S S S S S S #
M S S E R V F H L C V C D P L D S I L T S Q I Y N H I E Q I A P N I H V M F K S S L N Q N T E H Q L R Y Q E T E F V I S Y E D F H R P E F T S V P L F K D E M V L V A S K N H P T I K G P L L K H D V Y N E Q H A A V S L D R F A S F S Q P W Y D T V D K Q A S I A Y Q G M A M M S V L S V V S Q T H L V A I A P R W L A E E F A E S L E L Q V L P L P L K Q N S R T C Y L S W H E A A G R D K G H Q W M E E Q L V S I C K R L E H H H H H H, # # # # # # # # # # # # # # # # # # # # # # # # # # # # # # # # # # # # # # # # # # # # # # # # # # # # # # # # # # # # # # # # # # # # # # # # # # # # # # # # # # # # # # # # # # # # # # # # # # # # # # # # # # # # # # # # # # # # # # # # # # # # # # # # # # # # # # # # # # # # # # # # # # # # # # # # # # # # # # # # # # # # # # # # # # # # # # # # # # # # # # # # # # # # # # # # # # # # # # # ,# # # # # S S S S S S # # H H H H H H H H H H H H H H H H # # # # # S S S S S # # # # # H H H H H H H H H # # # S S S S # # # # # # # # S S S S S S S S S S S S S S S S # # # # # # # # # # H H H H H H H H # S S S S # # # # # # # # H H H H H # H H H H H H # S S S S S # H H H H H H H H H H # # # # # S S S S H H H H H H H H H H H H S S S S S # # # # # # S S S S S S S S S # # # # # H H H H H H H H H H H H H H H H H H H # # # # # #
M K K L L T V M T M A V L T A G T L L L P A Q S V T P A A H A V Q I S N S E R E L P F K A K H A Y S T I S Q L S E A I G P R I A G T A A E K K S A L L I A S S M R K L K L D V K V Q R F N I P D R L E G T L S S A G R D I L L Q A A S G S A P T E E Q G L T A P L Y N A G L G Y Q K D F T A D A K G K I A L I S R G D L T Y Y E K A K N A E A A G A K A V I I Y N N K E S L V P M T P N L S G N K V G I P V V G I K K E D G E A L T Q Q K E A T L K L K A F T N Q T S Q N I I G I K K P K N I K H P D I V Y V T A H Y D S V P F S P G A N D N G S G T S V M L E M A R V L K S V P S D K E I R F I A F G A E E L G L L G S S H Y V D H L S E K E L K R S E V N F N L D M V G T S W E K A S E L Y V N T L D G Q S N Y V W E S S R T A A E K I G F D S L S L T Q G G S S D H V P F H E A G I D S A N F I W G D P E T E E V E P W Y H T P E D S I E H I S K E R L Q Q A G D L V T A A V Y E A V K K E K K P K T I K K Q M K A K A S D I F E D I K, # # # # # # # # # # # # # # # # # # # # # # # # # # # # # # # # # # # # # # # # # # # # # # # # # # # # # # # # # # # # # # # # # # # # # # # # # # # # # # # # # # # # # # # # # # # # # # # # # # # # # # # # # # # # # # # # # # # # # # # # # # # # # # # # # # # # # # # # # # # # # # # # # # # # # # # # # # # # # # # # # # # # # # # # # # # # # # # # # # # # # # # # # # # # # # # # # # # # # # # # # # # # # # # # # # # # # # # # # # # # # # # # # # # # # # # # # # # # # # # # # # # # # # # # # # # # # # # # # # # # # # # # # # # # # # # # # # # # # # # # # # # # # # # # # # # # # # # # # # # # # # # # # # # # # # # # # # # # # # # # # # # # # # # # # # # # # # # # # # # # # # # # # # # # # # # # # # # # # # # # # # # # # # # # # # # # # # # # # # # # # # # # # # # # # # # # # # # # # # # # # # # # # # # # # # # # # # # # # # # # # # # # # # # # # # # # # # # # # # # # # # # # # # # # # # # # # # # # # # # # #,# # # # # # # # # # # # # # # # # # # # # # # # # # # # # # # # # # # # # # # # # # # H H H H H H H H H H H H H H # # # # # # # # H H H H H H H H H H H H H H H H H H # # S S S S S S S S # # # S S S S S S S S # # S S S # S S S # # # # # # # # # # # S S S S S S S # # # # H H H H H H H H H H # # S S S S S # # # # H H H H H H H H H H H H # # # S S S S S # # # # # # # # # # # # # # # # # # # # # S S S S H H H H H H H H H # # # S S S S S S S S S # # # S S S S S S S S S # # # # # # # # # S S S S S S S # # # # # # # # # # # # H H H H H H H H H H H H H H H H # # # # # # S S S S S S S # H H H H H H H H H H H H H H H # H H H H H H H S S S S S S S # # # # # # # # # # # S S S S S S # # # # # H H H H H H H H H H H H H H H # # # S S S S S # # # # H H H H H H H H # # S S S S S S S S # # # # # # # # # # # # # # # # H H H H H H H H H H H H H H H H H H H H H H H H H H # # # # # # # # # # # # # # H H H H H # # # # #
D Y K D D D D K V L G L K Y E E I D C L I N D E H T I K G R R E G N E V F L P F T W V E K Y F D V Y G K V V Q Y D G Y D R F E F S H S Y S K V Y A Q R A P Y H P D G V F M S F E G Y N V E V R D R V K C I S G V E G V P L S T Q W G P Q G Y F Y P I Q I A Q Y G L S H Y S K N L T E K P P H I E V Y E T A E D R D K N K P N D W T V P K G C F M A N V A D K S R F T N V K Q F I A P E T S E G V S L Q L G N T K D F I I S F D L K F L T N G S V S V V L E T T E K N Q L F T I H Y V S N A Q L I A F K E R D I Y Y G I G P R T S W S T V T R D L V T D L R K G V G L S N T K A V K P T K I M P K K V V R L I A K G K G F L D N I T I S T T A H M A A F F A A S D W L V R N Q D E K G G W P I M V T R K L G E G F K S L E P G W Y S A M A Q G Q A I S T L V R A Y L L T K D H I F L N S A L R A T A P Y K F L S E Q H G V K A V F M N K H D W Y E E Y P T T P S S F V L N G F M Y S L I G L Y D L K E T A G E K L G K E A R S L Y E R G M E S L K A M L P L Y D T G S G T I Y D L R H F M L G I A P N L A R W D Y H T T H I N Q L Q L L S T I D E S P V F K E F V K R W K S Y L K G S R A K H N, # # # # # # # # # # # # # # # # # # # # # # # # # # # # # # # # # # # # # # # # # # # # # # # # # # # # # # # # # # # # # # # # # # # # # # # # # # # # # # # # # # # # # # # # # # # # # # # # # # # # # # # # # # # # # # # # # # # # # # # # # # # # # # # # # # # # # # # # # # # # # # # # # # # # # # # # # # # # # # # # # # # # # # # # # # # # # # # # # # # # # # # # # # # # # # # # # # # # # # # # # # # # # # # # # # # # # # # # # # # # # # # # # # # # # # # # # # # # # # # # # # # # # # # # # # # # # # # # # # # # # # # # # # # # # # # # # # # # # # # # # # # # # # # # # # # # # # # # # # # # # # # # # # # # # # # # # # # # # # # # # # # # # # # # # # # # # # # # # # # # # # # # # # # # # # # # # # # # # # # # # # # # # # # # # # # # # # # # # # # # # # # # # # # # # # # # # # # # # # # # # # # # # # # # # # # # # # # # # # # # # # # # # # # # # # # # # # # # # # # # # # # # # # # # # # # # # # # # # # # # # # # # # # # # # # # # # # # # # # # # # # # # # # # # # # # # # # # # # # # # # # # # # # # # # # # # # # # # # # # # # # # # # # # # # # # # #,# # # # # # # # # # # # # # S S S S S S S # # # S S S S S S S S # # S S S # # H H H H H H H H H # S S S S S S S # # S S S S S S S # # # # # # # # # # # # # # # # # # # # H H H H H # # # # # # # S S S S # # # # # # S S S # # # # # # # # # H H H H H H H H H H H H H H H H H H H # # # # S S S S S # # # # # # # # # # # # # # # # # # # S S S S S S S H H H H S S S S S S S S # # # # # # S S S S # # # # # # # S S S S S S S S # # # S S S S S S S S # # # # # # S S S S S S S # # # # # # S S S # # S S S S S # # # # # # # S S S S S S H H H H H H H H H H # # # # # # # # # # # # # # # S S S S S S S S S S S S S S # S S S S # # H H H H H H H H H H H H H H H H H # # # # # # # # # # # # # # # # # # # # # # # # # # H H H H H H H H H H H H H H H H H H H H H H H H H H H H H H H H H H H H H H H H H H # # S S S S # # # S S S S # # # # # # # # # # H H H H H H H H H H H H H H H H H H H H # # # H H H H H H H H H H H H H H H H H H H H H H H # # # # # # # # H H H H H H H # # # # # # H H H H H H H H H H H H H H H H H # # # H H H H H H H H H H H H H H H # # # # # # # #
M N K Y T I A I D L G Y G Q I K G I N Q D N K R V I F P S I I S S G K D R S L D T F F N S I D N I V D N I H V K I L D E Y F N E K E Y F V G E L A K R Q P S N S S F I N R D N K I N S E E N K V L L A T A L G L L I P N D L P N D T K I H I V T G L P L E H F I K Q K Q A L N D M L K D F E H T I K F V D H N F S R N I K F E E S N I T L F P Q G A G A I F S K I N N D I S S L L I K E T F I G L I D V G F K T T D I V V F R I N K D K E P V F E Q E M S A T L D G L G M I N I Y N T M D K A F T D N S R D G S K L N T E Q L M L L C E E G K I F F K G D Y I D L K K D L I K A R K T L S T N I I N K A D G L W G S R K N S F N S I M I A G G G G K V L Y N H L K L I E P N M C Q L I D N P E F A N A I G Y L E F G K Q F, # # # # # # # # # # # # # # # # # # # # # # # # # # # # # # # # # # # # # # # # # # # # # # # # # # # # # # # # # # # # # # # # # # # # # # # # # # # # # # # # # # # # # # # # # # # # # # # # # # # # # # # # # # # # # # # # # # # # # # # # # # # # # # # # # # # # # # # # # # # # # # # # # # # # # # # # # # # # # # # # # # # # # # # # # # # # # # # # # # # # # # # # # # # # # # # # # # # # # # # # # # # # # # # # # # # # # # # # # # # # # # # # # # # # # # # # # # # # # # # # # # # # # # # # # # # # # # # # # # # # # # # # # # # # # # # # # # # # # # # # # # # # # # # # # # # # # # # # # # # # # # # # # # # # # # # # # # # # # # # # # # # # # # # # # # # # # # # # # # # # # # # # # # # # # # # # # # #,# # # S S S S S # # # # # S S S S S S # # # # S S S S S # # S S S # # # # H H H H H H H # # # # # # # # # S S S S # # # # # # # S S S S S H H H H H H H # # # # # # # # # # # # # # H H H H H H H H H H H H H H # # # # # # # # # # # S S S S S S S # # H H H H H H H H H H H H H H H H H S S S S S S # # # # # S S S S S # # # # # # S S S S # H H H H H H H # # # # H H H H H # # # # # S S S S S S S # # # # S S S S S S S S # # # # # S S S # # # # # S S S # # # # H H H H H H H H H H H H H H H H H # # # # # H H H H H H H H H H H H S S S # # # # S S S H H H H H H H H H H H H H H H H H H H H H H H H H H H H H # S S S S S S S H H H H H H H H # H H H H H H # # # # S S # # # # # H H H H H H H H H H # # # #
G S H M A P F V A K D I R V D G V Q G D L E Q Q I R A S L P V R A G Q R V T D N D V A N I V R S L F V S G R F D D V K A H Q E G D V L V V S V V A K S I I S D V K I K G N S I I P T E A L K Q N L D A N G F K V G D V L I R E K L N E F A K S V K E H Y A S V G R Y N A T V E P I V N T L P N N R A E I L I Q I N E D D K A K L A S L T F K G N E S V S S S T L Q E Q M E L Q P D S W W K L W G N K F E G A Q F E K D L Q S I R D Y Y L N N G Y A K A Q I T K T D V Q L N D E K T K V N V T I D V N E G L Q Y D L R S A R I I G N L G G M S A E L E P L L S A L H L N D T F R R S D I A D V E N A I K A K L G E R G Y G S A T V N S V P D F D D A N K T L A I T L V V D A G R R L T V R Q, # # # # # # # # # # # # # # # # # # # # # # # # # # # # # # # # # # # # # # # # # # # # # # # # # # # # # # # # # # # # # # # # # # # # # # # # # # # # # # # # # # # # # # # # # # # # # # # # # # # # # # # # # # # # # # # # # # # # # # # # # # # # # # # # # # # # # # # # # # # # # # # # # # # # # # # # # # # # # # # # # # # # # # # # # # # # # # # # # # # # # # # # # # # # # # # # # # # # # # # # # # # # # # # # # # # # # # # # # # # # # # # # # # # # # # # # # # # # # # # # # # # # # # # # # # # # # # # # # # # # # # # # # # # # # # # # # # # # # # # # # # # # # # # # # # # # # # # # # # # # # # # # # # # # # # # # # # # # # # # # # # # # # # # # # # # # # # # # # # #,# # # # # # S S # # # # # # # # # # H H H H H H H H H H H # # # # # # S S H H H H H H H H H H H H H H H # # S S S S S S S S S # # S S S S S S S S # # S S S S S S S S # # # # # H H H H H H H H H H H H # # # # # # # # H H H H H H H H H H H H H H H H H H H # # # # # S S S S S S S S S # # # S S S S S S S S S # # # # # # S S S S S S S # # # # # H H H H H H # # # # # # # # # # # # # # # # # # # # H H H H H H H H H H H H H H H H # # # # # # S S S S S S S S # # # # # # # S S S S S S S S # # # # # S S S S S S S S S # # # # H H H H H H H H H # # # # # # S S # H H H H H H H H H H H H H H H H H H H # # # # # S S S S S # # S S # # # # S S S S S S S S S # # # # # # # # #
L A N Y E T Y D G F K V S E E P V L P E K E V H P S L W F T K S D I Q K I K E K K N E D S F T A E L W E E I S N S P Y L T M E I P T D I P S A T D S D T D I H K Y Y G N M S R I A K Y N A F M Y L M T G K S E Y R L R A T E A L K R A F D G P I Y E M D P T V S G S G V D E I Y R A V W A Q N F A T A Y D W I Q P Y L S D E D D E I I R E R L A K E A Q V V Y E N L Y T W G P R P H N H L S K P A W G L G T L A L T L S D H P D A S K W L N R A L E A A N T N T L Y F F N K D G H Y R E G A H Y Y V Y S L V N L I P F L Y H Y K N V S G V N Y F P E Y K N I F E W A V K I R N G R G W M P N V E D S W I K P A P T H M V A S Q Y K D T D T D L H S T A K L A N I L Q W S Y F N T D F R P W E P D G S Y T G A S Y D D T W D I D Q Y L T Y D S T I E Q I K P D V S G T V F M N N S G Q T V F R S D W N F N N P N S R Y L L F Q G V A E A D N H Y H Y D H L S F I I H A E N Q M M A S D S G Y S R N S Y G E G I R T S W Y L T A E A H N V I T A N G E H P K D V S E N T T P V S R Y D M D T D F F D F Q E K E A V Y D G F T F P E K N S Y D F S G K Q I R A I G F P R Q D Y F V V A D Q L F S D K E V Q Y D L Y L H G G R G E M S G E G N Y R L W T Y E D D R Y G Q E A K M A A W V F P S K E S I F I D K E G E V N Y E A G A F N S Y G Y L N A R Q I A K D T M F M Q I I V P L S K Y A D I P E V V D L S T D D V V G G T V V K D N E K D T F M Q Q L N N A E N S L G D I T T D A T F A Y T N E N S N N E L Q H F S V R Q G T S L D Y K G E N I F V S N K P I T F A L D I S D E T Q Y K G T I A A L N E T V E L R V K N P V G V P T E S V V V N G E N I E F S V E D G Y T V I Q V A E G G D I N I N F G E G, # # # # # # # # # # # # # # # # # # # # # # # # # # # # # # # # # # # # # # # # # # # # # # # # # # # # # # # # # # # # # # # # # # # # # # # # # # # # # # # # # # # # # # # # # # # # # # # # # # # # # # # # # # # # # # # # # # # # # # # # # # # # # # # # # # # # # # # # # # # # # # # # # # # # # # # # # # # # # # # # # # # # # # # # # # # # # # # # # # # # # # # # # # # # # # # # # # # # # # # # # # # # # # # # # # # # # # # # # # # # # # # # # # # # # # # # # # # # # # # # # # # # # # # # # # # # # # # # # # # # # # # # # # # # # # # # # # # # # # # # # # # # # # # # # # # # # # # # # # # # # # # # # # # # # # # # # # # # # # # # # # # # # # # # # # # # # # # # # # # # # # # # # # # # # # # # # # # # # # # # # # # # # # # # # # # # # # # # # # # # # # # # # # # # # # # # # # # # # # # # # # # # # # # # # # # # # # # # # # # # # # # # # # # # # # # # # # # # # # # # # # # # # # # # # # # # # # # # # # # # # # # # # # # # # # # # # # # # # # # # # # # # # # # # # # # # # # # # # # # # # # # # # # # # # # # # # # # # # # # # # # # # # # # # # # # # # # # # # # # # # # # # # # # # # # # # # # # # # # # # # # # # # # # # # # # # # # # # # # # # # # # # # # # # # # # # # # # # # # # # # # # # # # # # # # # # # # # # # # # # # # # # # # # # # # # # # # # # # # # # # # # # # # # # # # # # # # # # # # # # # # # # # # # # # # # # # # # # # # # # # # # # # # # # # # # # # # # # # # # # # # # # # # # # # # # # # # # # # # # # # # # # # # # # # # # # # # # # # # # # # # # # # # # # # # # # # # # # # # # # # # # # # # # # # # # # # # # # # #,# # # # # # # # # # # # # # # # # # # # # # # # # # # # # H H H H H H H H H H H H H H H H H H H H H H H H H H # H H H H H H # # # # # # # # # # # H H H H H H H H H H H H H H H H H H H H H H H H H H H H H H H H H H H H H H H H H # # # # # # # # # # # # # # # # # # # # # H H H H H H H H H H H H H H H H H H H H H H H H H H H H H H H H H H H H H H H H H H H H H H H # # # H H H H H H H H H H H H H H H H H H # # # # H H H H H H H H H H H H H H H H H H H H # # # # # # # # # H H H H H H H H H H H H H H H H H H H H H H H H # # # # # # # H H H H H H H H H H H # # # # # # # # # # # # # # # # # # H H H H H H # # # # # # # # # # # # # H H H H H H H H H H H H # # H H H H H # # # # # # # # # # # # H H H H H H H H H H # # # # # # # # # # # # # # S S S # # # # S S S S S # # # # # # # # # # S S S S S S # # # # # # # # # # # # # # S S S S S S # # S S # # # # # # # # # # # # # H H H H H H H # # H H H H H # # S S S # # # # # # # # # # # # # # S S S S S S # # # # # # S S S S S S S # # # # # # # # # # # # # # # S S S S S S S S # H H H H # S S S S S S S S S # # # S S S S S S S S # # # # S S S # # # # S S S S S S # # # # # # # # S S S S S S S S # # # # # S S S S S S S S S # # # # # # # S S S S S S S S S S S S # # S S S S S S S S S S S # # # # # # S S S S # # # # # # S S S S S S S # # S S S S S S S # # # # # # S S S # # S S S # # # S S S S S S # # # # # S S S S S S S S S S S S S S # # S S S S S S S S S S S S S S S # # # # # S S S S S S # # # # # # S S S S S S # # # # # # S S S S S S # # S S S # S S S S # # S S S S S S # # # S S S S S S S # # #
Y Q L Q P L S L D S V P W R R Q P G Q Q V L W I G C S D S G C D E L E S S G L P A D E I F E Y R S L G N M M V D D L S C K A T L G Y A L D S L K I R N I V I C G H Y G C H I A S G E V N A G L Q K P W S S V L D T L R S T H R R T L D S L T G T E R D R A L V E L N V L E Q V H S L R Q S A E A A E A L Q K Q Q L N I W G M V Y D K A T K R G Y Q L I, # # # # # # # # # # # # # # # # # # # # # # # # # # # # # # # # # # # # # # # # # # # # # # # # # # # # # # # # # # # # # # # # # # # # # # # # # # # # # # # # # # # # # # # # # # # # # # # # # # # # # # # # # # # # # # # # # # # # # # # # # # # # # # # # # # # # # # # # # # # # # H H H H H H H H H H H H H H H H H H H H H H H H H H H H H H H H H H H H,# # S S S # # # # # # # # # # # # # # # S S S S S S # # # H H H H H H H H # # H H H # S S S S S S H H H H # # # H H H H H H H H H H H H H H # # # # S S S S S S S # # # # # # # # # # # # # # # # H H H H H H H H H H H H H H H H H H H # H H H H H H H H H H H H H H H H H H H H H H H H H H H H H H H H H # # # S S S S S S S S # # # # S S S S S #
T P R G F V V H T A P V G L A D D G R D D F T V L A S T A P A T V S A V F T R S R F A G P S V V L C R E A V A D G Q A R G V V V L A R N A N V A T G L E G E E N A R E V R E A V A R A L G L P E G E M L I A S T G V I G R Q Y P M E S I R E H L K T L E W P A G E G G F D R A A R A I M T T D T R P K E V R V S V G G A T L V G I A K G V G M L E P D M A, # # # # # # # # # # # # # # # # # # # # # # # # # # # # # # # # # # # # # # # # # # # # # # # # # # # # # # # # # # # # # # # # # # # # # # # # # # # # # # # # # # # # # # # # # # # # # # # # # # # # # # # # # # # # # # # # # # # # # # # # # # # # # # # # # # # # # # # # # # # # # # # # H H H H H H H H H H H H H H H H H H H H H H H H H H H H H H H H H H H,# # # # S S S S S S # # # # # # # # # # # S S S S S S # # # S S S S S S S # # # # # # H H H H H H H H H H H H # # # # # S S S S S S # # # # # # H H H H H H H H H H H H H H H H H H H H # # H H H # S S S S S S # # # # # # # H H H H H H H H H H # # # # # # # # # H H H H H H H H H # # # # # # # S S S S S S S # # S S S S S S S S # # # # # # # # # #
M E A D A R S I Y V G N V D Y G A T A E E L E A H F H G C G S V N R V T I L C D K F S G H P K G F A Y I E F S D K E S V R T S L A L D E S L F R G R Q I K V I P K R T N R P G I L E H H H H H H, # # # # # # # # # # # # # # # # # # # # # # # # # # # # # # # # # # # # # # # # # # # # # # # # # # # # # # # # # # # # # # # # # # # # # # # # # # # # # # # # # # # # # # # # ,# # H H H # S S S S S # # # # # # H H H H H H H H H H H H H # S S S S S S S S # # # # # # # # S S S S S S S # # H H H H H H H H H H H # # S S # # S S # S S S S # # # # # # # # # # # # # # # #
A Y N P Y P E D Y G D I E I G, # # # # # # # # # # # # # # # # # # # # H,# # # # H H H H H S S S S S #
